{
  "schema_version": "rapidforensic-e01-ex01-truth-manifest-v1",
  "corpus_id": "t1-minimal-ex01-template",
  "case_id": "t1-minimal-ex01-template-case",
  "image_id": "t1-minimal-ex01-template-image",
  "image_format": "Ex01",
  "filesystem_type": "NTFS",
  "image_segments": [
    {
      "segment_path": "EXTERNAL_PLACEHOLDER/images/ex01/t1-minimal.Ex01",
      "segment_index": 0,
      "size_bytes": 1,
      "sha256": "3333333333333333333333333333333333333333333333333333333333333333"
    }
  ],
  "image_sha256": "3333333333333333333333333333333333333333333333333333333333333333",
  "image_size_bytes": 1,
  "acquisition_tool": "REPLACE_WITH_APPROVED_EX01_TOOL",
  "acquisition_tool_version": "REPLACE_WITH_ACTUAL_VERSION",
  "source_os": "Windows",
  "source_os_version": "REPLACE_WITH_WINDOWS_VERSION",
  "creation_timestamp_utc": "2026-06-17T00:00:00Z",
  "timezone": "UTC",
  "corpus_tier": "T1",
  "license": "Synthetic internal validation fixture; replace with actual evidence policy",
  "pii_status": "synthetic",
  "malware_status": "none",
  "retention_policy": "External controlled storage only; do not commit binary evidence to Git",
  "chain_of_custody": [
    {
      "created_by": "REPLACE_WITH_OPERATOR",
      "reviewed_by": [],
      "creation_method": "Template only; replace after actual Windows NTFS Ex01 acquisition",
      "storage_location": "EXTERNAL_PLACEHOLDER",
      "hash_algorithm": "sha256",
      "hash_recorded_at": "2026-06-17T00:00:00Z",
      "review_status": "draft"
    }
  ],
  "trusted_tool_runs": [
    {
      "run_id": "trusted-template-ex01-001",
      "tool_name": "REPLACE_WITH_TRUSTED_REFERENCE_TOOL",
      "tool_version": "REPLACE_WITH_ACTUAL_VERSION",
      "command": "Template only; replace with actual trusted/reference export command",
      "run_timestamp_utc": "2026-06-17T00:00:00Z",
      "host_os": "Windows",
      "output_path": "EXTERNAL_PLACEHOLDER/trusted-exports/ex01-normalized.json",
      "output_sha256": "4444444444444444444444444444444444444444444444444444444444444444",
      "notes": "Schema-valid template only; not generated from real Ex01 evidence."
    }
  ],
  "expected_items": [
    {
      "item_id": "t1-ex01-korean-path",
      "original_path": "source-tree/unicode/한글파일.txt",
      "normalized_path": "source-tree/unicode/한글파일.txt",
      "expected_status": "allocated",
      "expected_recovery": "must_recover_byte_exact",
      "expected_recovery_mode": "filesystem",
      "file_type": "text/plain",
      "size_bytes": 1,
      "sha256": "5555555555555555555555555555555555555555555555555555555555555555",
      "md5_optional": null,
      "created_time_utc": null,
      "modified_time_utc": "2026-06-17T00:00:00Z",
      "accessed_time_utc": null,
      "deleted_time_utc_optional": null,
      "path_encoding": "UTF-8",
      "unicode_normalization": "NFC",
      "ads_name_optional": null,
      "is_sparse": false,
      "is_fragmented": false,
      "is_carved_only": false,
      "trusted_tool_run_ids": [
        "trusted-template-ex01-001"
      ],
      "expected_metadata": {
        "template_notice": "Replace all dummy values after actual corpus generation."
      },
      "accepted_variants": [],
      "expected_failure_reason": null,
      "notes": "Schema-valid template only; not release evidence."
    }
  ],
  "expected_global_outcomes": {
    "min_recall": 1,
    "min_precision": 1,
    "max_false_positives": 0,
    "max_inconclusive": 0,
    "max_runtime_seconds": 300,
    "max_peak_memory_mb": 2048,
    "required_logs": [
      "rapid-run.log",
      "trusted-export.log"
    ],
    "required_reports": [
      "trusted-diff.json",
      "operator-review.md"
    ]
  },
  "notes": "Schema-valid template only. Not generated from real Ex01 evidence. Do not use as release evidence. Replace dummy hashes after actual corpus generation."
}
